{
  "$schema": "./schema.json",
  "schemaVersion": "lb.token-list.v1",
  "environment": "localnet",
  "chainId": 31337,
  "name": "Robinhood LB Localnet Token List",
  "updatedAt": "2026-07-14",
  "tokens": [
    {
      "id": "wnative",
      "approvalBehavior": "standard-bool",
      "symbol": "WNATIVE",
      "name": "Wrapped Native",
      "addressRef": "tokens.wnative",
      "decimals": 18,
      "logoURI": "/token-assets/wnative.svg",
      "tags": ["localnet", "mock", "wrapped-native"]
    },
    {
      "id": "usdc",
      "approvalBehavior": "standard-bool",
      "symbol": "USDC",
      "name": "Mock USDC",
      "addressRef": "tokens.usdc",
      "decimals": 18,
      "logoURI": "/token-assets/usdc.svg",
      "tags": ["localnet", "mock", "quote", "stablecoin"]
    },
    {
      "id": "usdt",
      "approvalBehavior": "standard-bool",
      "symbol": "USDT",
      "name": "Mock USDT",
      "addressRef": "tokens.usdt",
      "decimals": 18,
      "logoURI": "/token-assets/usdt.svg",
      "tags": ["localnet", "mock", "quote", "stablecoin"]
    },
    {
      "id": "weth",
      "approvalBehavior": "standard-bool",
      "symbol": "WETH",
      "name": "Mock WETH",
      "addressRef": "tokens.weth",
      "decimals": 18,
      "logoURI": "/token-assets/weth.svg",
      "tags": ["localnet", "mock"]
    }
  ]
}
